{
  "$schema": "https://json-schema.org/draft/2020-12/schema",
  "$id": "urn:collector:export-format:v2",
  "title": "Collector export, format version 2",
  "description": "The part of a well-formed Collector export that a schema can state. README.md beside this file defines the format and lists the rules a schema can't state: the file is UTF-8 JSON with no repeated key, every time is a real moment, no lot was changed before it was added, no two lots have the same identity, and no two locations have the same name once the names are normalised (NFC) and case folded.",
  "type": "object",
  "required": ["format", "format_version", "exported_at", "profile", "currency", "locations", "lots"],
  "properties": {
    "format": { "const": "collector-export" },
    "format_version": { "const": 2 },
    "exported_at": { "$ref": "#/$defs/time" },
    "generator": { "type": "string" },
    "profile": {
      "type": "object",
      "required": ["name", "email_address", "collection_view"],
      "properties": {
        "name": { "$ref": "#/$defs/text" },
        "email_address": { "$ref": "#/$defs/text" },
        "collection_view": { "$ref": "#/$defs/text" }
      }
    },
    "currency": { "type": "string", "pattern": "^[A-Z]{3}$" },
    "locations": { "type": "array", "maxItems": 500, "items": { "$ref": "#/$defs/location" } },
    "lots": { "type": "array", "items": { "$ref": "#/$defs/lot" } }
  },
  "$defs": {
    "text": {
      "description": "A string that isn't empty or only whitespace.",
      "type": "string",
      "pattern": "\\S"
    },
    "recorded_text": {
      "description": "A string that isn't empty or only whitespace, or null when not recorded.",
      "type": ["string", "null"],
      "pattern": "\\S"
    },
    "time": {
      "description": "RFC 3339 in UTC with a Z and no fraction of a second.",
      "type": "string",
      "pattern": "^[0-9]{4}-[0-9]{2}-[0-9]{2}T[0-9]{2}:[0-9]{2}:[0-9]{2}Z$"
    },
    "location": {
      "type": "object",
      "required": ["name"],
      "properties": {
        "name": { "$ref": "#/$defs/location_name" }
      }
    },
    "location_name": {
      "description": "1 to 60 code points: words with no Cc or Cf character and no White_Space other than U+0020, separated by single U+0020 and not padded. The empty string passes the pattern so that minLength alone fails it.",
      "type": "string",
      "minLength": 1,
      "maxLength": 60,
      "pattern": "^([^\\p{Cc}\\p{Cf}\\t-\\r\\u0085\\u00A0\\u1680\\u2000-\\u200A\\u2028\\u2029\\u202F\\u205F\\u3000 ]+( [^\\p{Cc}\\p{Cf}\\t-\\r\\u0085\\u00A0\\u1680\\u2000-\\u200A\\u2028\\u2029\\u202F\\u205F\\u3000 ]+)*)?$"
    },
    "lot": {
      "type": "object",
      "required": ["entry", "quantity", "finish", "condition", "price_paid", "added_at", "changed_at"],
      "properties": {
        "entry": { "$ref": "#/$defs/entry" },
        "quantity": { "type": "integer", "minimum": 1, "maximum": 9999 },
        "finish": { "$ref": "#/$defs/recorded_text" },
        "condition": { "$ref": "#/$defs/recorded_text" },
        "price_paid": {
          "description": "The price of one copy with exactly two decimal places, or null when not recorded.",
          "type": ["string", "null"],
          "pattern": "^(0|[1-9][0-9]*)\\.[0-9]{2}$"
        },
        "added_at": { "$ref": "#/$defs/time" },
        "changed_at": { "$ref": "#/$defs/time" }
      }
    },
    "entry": {
      "type": "object",
      "required": ["collectible_type", "source_id", "name", "set_code", "collector_number", "language"],
      "properties": {
        "collectible_type": { "$ref": "#/$defs/text" },
        "source_id": { "$ref": "#/$defs/text" },
        "name": { "$ref": "#/$defs/text" },
        "set_code": { "$ref": "#/$defs/text" },
        "collector_number": { "$ref": "#/$defs/text" },
        "language": { "$ref": "#/$defs/text" }
      }
    }
  }
}
